,userId,id,title,completed
191,10,192,ut quas possimus exercitationem sint voluptates,False
190,10,191,temporibus atque distinctio omnis eius impedit tempore molestias pariatur,True
189,10,190,accusamus sint iusto et voluptatem exercitationem,True
188,10,189,culpa eius et voluptatem et,True
180,10,181,ut cupiditate sequi aliquam fuga maiores,False
181,10,182,inventore saepe cumque et aut illum enim,True
182,10,183,omnis nulla eum aliquam distinctio,True
183,10,184,molestias modi perferendis perspiciatis,False
196,10,197,dignissimos quo nobis earum saepe,True
197,10,198,quis eius est sint explicabo,True
198,10,199,numquam repellendus a magnam,True
199,10,200,ipsam aperiam voluptates qui,False
195,10,196,consequuntur aut ut fugit similique,True
194,10,195,rerum ex veniam mollitia voluptatibus pariatur,True
193,10,194,sed ut vero sit molestiae,False
192,10,193,rerum debitis voluptatem qui eveniet tempora distinctio a,True
187,10,188,vel non beatae est,True
186,10,187,consequuntur animi possimus,False
185,10,186,explicabo odio est et,False
184,10,185,voluptates dignissimos sed doloribus animi quaerat aut,False
163,9,164,reprehenderit quos aut aut consequatur est sed,False
162,9,163,natus corrupti maxime laudantium et voluptatem laboriosam odit,False
161,9,162,omnis laboriosam molestias animi sunt dolore,True
160,9,161,ex hic consequuntur earum omnis alias ut occaecati culpa,True
167,9,168,recusandae quia qui sunt libero,False
166,9,167,et quis minus quo a asperiores molestiae,False
165,9,166,quos quo possimus suscipit minima ut,False
164,9,165,fugiat perferendis sed aut quidem,False
176,9,177,et placeat temporibus voluptas est tempora quos quibusdam,False
177,9,178,nesciunt itaque commodi tempore,True
178,9,179,omnis consequuntur cupiditate impedit itaque ipsam quo,True
179,9,180,debitis nisi et dolorem repellat et,True
175,9,176,magni soluta corrupti ut maiores rem quidem,False
174,9,175,laudantium eius officia perferendis provident perspiciatis asperiores,True
173,9,174,similique aut quo,False
172,9,173,harum ad aperiam quis,False
168,9,169,ea odio perferendis officiis,True
169,9,170,quisquam aliquam quia doloribus aut,False
170,9,171,fugiat aut voluptatibus corrupti deleniti velit iste odio,True
171,9,172,et provident amet rerum consectetur et voluptatum,False
155,8,156,nam quia quia nulla repellat assumenda quibusdam sit nobis,True
154,8,155,voluptatem nobis consequatur et assumenda magnam,True
153,8,154,rerum non ex sapiente,True
152,8,153,ea aperiam consequatur qui repellat eos,False
147,8,148,esse quas et quo quasi exercitationem,False
146,8,147,eum itaque quod reprehenderit et facilis dolor autem ut,True
145,8,146,molestiae suscipit ratione nihil odio libero impedit vero totam,True
144,8,145,beatae qui ullam incidunt voluptatem non nisi aliquam,False
143,8,144,ut eum exercitationem sint,False
142,8,143,eum non recusandae cupiditate animi,False
141,8,142,maiores accusantium architecto necessitatibus reiciendis ea aut,True
140,8,141,explicabo consectetur debitis voluptates quas quae culpa rerum non,True
151,8,152,odit eligendi recusandae doloremque cumque non,False
150,8,151,accusamus adipisci dicta qui quo ea explicabo sed vero,True
149,8,150,eos amet tempore laudantium fugit a,False
148,8,149,animi voluptas quod perferendis est,False
156,8,157,dolorem veniam quisquam deserunt repellendus,True
157,8,158,debitis vitae delectus et harum accusamus aut deleniti a,True
158,8,159,debitis adipisci quibusdam aliquam sed dolore ea praesentium nobis,True
159,8,160,et praesentium aliquam est,False
131,7,132,qui molestiae voluptatibus velit iure harum quisquam,True
130,7,131,qui ea incidunt quis,False
129,7,130,nulla aliquid eveniet harum laborum libero alias ut unde,True
128,7,129,rerum culpa quis harum,False
135,7,136,asperiores illo tempora fuga sed ut quasi adipisci,False
134,7,135,facere ipsa nam eum voluptates reiciendis vero qui,False
133,7,134,molestiae doloribus et laborum quod ea,False
132,7,133,et labore eos enim rerum consequatur sunt,True
123,7,124,qui consectetur id,False
122,7,123,esse et quis iste est earum aut impedit,False
121,7,122,provident aut nobis culpa,True
120,7,121,inventore aut nihil minima laudantium hic qui omnis,True
127,7,128,eius omnis est qui voluptatem autem,False
126,7,127,voluptatem libero consectetur rerum ut,True
125,7,126,ut asperiores perspiciatis veniam ipsum rerum saepe,True
124,7,125,aut quasi autem iste tempore illum possimus,False
136,7,137,qui sit non,False
137,7,138,placeat minima consequatur rem qui ut,True
138,7,139,consequatur doloribus id possimus voluptas a voluptatem,False
139,7,140,aut consectetur in blanditiis deserunt quia sed laboriosam,True
119,6,120,dolorem laboriosam vel voluptas et aliquam quasi,False
118,6,119,corporis ducimus ea perspiciatis iste,False
117,6,118,quia modi consequatur vero fugiat,False
116,6,117,sequi quae est et qui qui eveniet asperiores,False
100,6,101,explicabo enim cumque porro aperiam occaecati minima,False
101,6,102,sed ab consequatur,False
102,6,103,non sunt delectus illo nulla tenetur enim omnis,False
103,6,104,excepturi non laudantium quo,False
112,6,113,quia atque aliquam sunt impedit voluptatum rerum assumenda nisi,False
113,6,114,cupiditate quos possimus corporis quisquam exercitationem beatae,False
114,6,115,sed et ea eum,False
115,6,116,ipsa dolores vel facilis ut,True
104,6,105,totam quia dolorem et illum repellat voluptas optio,True
105,6,106,ad illo quis voluptatem temporibus,True
106,6,107,praesentium facilis omnis laudantium fugit ad iusto nihil nesciunt,False
107,6,108,a eos eaque nihil et exercitationem incidunt delectus,True
108,6,109,autem temporibus harum quisquam in culpa,True
109,6,110,aut aut ea corporis,True
110,6,111,magni accusantium labore et id quis provident,False
111,6,112,consectetur impedit quisquam qui deserunt non rerum consequuntur eius,False
87,5,88,vitae aut excepturi laboriosam sint aliquam et et accusantium,False
86,5,87,laudantium quae eligendi consequatur quia et vero autem,True
85,5,86,incidunt ut saepe autem,True
84,5,85,et quia ad iste a,True
99,5,100,excepturi a et neque qui expedita vel voluptate,False
98,5,99,neque voluptates ratione,False
97,5,98,debitis accusantium ut quo facilis nihil quis sapiente necessitatibus,True
96,5,97,dolorum laboriosam eos qui iure aliquam,False
88,5,89,sequi ut omnis et,True
89,5,90,molestiae nisi accusantium tenetur dolorem et,True
90,5,91,nulla quis consequatur saepe qui id expedita,True
91,5,92,in omnis laboriosam,True
95,5,96,nobis suscipit ducimus enim asperiores voluptas,False
94,5,95,vel nihil et molestiae iusto assumenda nemo quo ut,True
93,5,94,facilis modi saepe mollitia,False
92,5,93,odio iure consequatur molestiae quibusdam necessitatibus quia sint,True
80,5,81,suscipit qui totam,True
81,5,82,voluptates eum voluptas et dicta,False
82,5,83,quidem at rerum quis ex aut sit quam,True
83,5,84,sunt veritatis ut voluptate,False
